name	writer
うっかり湖に斧を落としたら　怒った神が浮上した	瀬嵐しるん
小さな歌姫と大きな騎士さまのねがいごと	石河 翠
本当はとても邪神な童話集	北瀬野ゆなき
魔法使いはとっくに来てた	瀬嵐しるん
深海の魔女は呪うのがお好き	サクモ明葉
ひとりぼっちの精霊さま	ひつじのはね
百貫姫にまつわる三つの物語	楠瑞稀
赤ずきんと灰色狼	桜瀬彩香
読み専が紹介する『なろうお気に入り作品』	ひょろ
ブクマや評価を入れてくれれば連載します？ふぅん、じゃあ連載始まったらブクマと評価外すね？	燦々SUN
最近のランキング、なんだかなぁどころじゃねえ。	時の権能者
好きななろう作家さんが書籍化デビューしたけど、絵師が生理的に無理だった場合	心の中で炎上中
最近のランキング、なんだかなぁと思う。	時の権能者
感想で作者に筆を折らせた方、楽しかったですか？	静
拝啓　エタりそうな作者様、エタが嫌いな読者様。これがなろうの現実です。	応援されたい作者
小説家になろう　ランキング上位にいくための、不正なポイント稼ぎについて	森永ピノ子
長文説明型タイトルの問題点について	丘/丘野　優
ある日突然、私の口座に間違って二千万が振り込まれたときの話	新道 梨果子
アダルト広告は排除して欲しいという切なる願い！	椎名ユズキ
プークスクス！　どれだけ面白い小説書いた所であなたの話なんて誰も読みませんからｗｗｗ	熊ノ翁
行きつけのインド人がやってるカレー屋でたまたま七福神の話題になったとき、七福神の中にインド人が３人いるよと教えたら、インド人のテンション⬆⬆になった話	ξ˚⊿˚)ξ ただのぎょー
最弱装備として有名な『かわのたて』を作ってみて思うこと（写真付き）	中々中（旧：フェフオウフコポォ）
短編詐欺が損をする	はとさぶれ
こんな感想は嫌われる！？作家がモヤる”悪気の無い感想”７選	とびらの
調子にのって『ひのきのぼう』も作ってみた。あと『かわのたて』も改良してみた（写真付き）	中々中（旧：フェフオウフコポォ）
神戸製鋼の件でいい機会だし、アルミについて見直すべきことを主張してみたいと思う。	御代出　実葉
文系脳でごめんなさい	中村 颯希
熊エッセイ2021	熊ノ翁
盗作の末路	秋口峻砂
札幌の市街地に出たヒグマについて、感覚が麻痺した北海道民の反応。	遊び怠惰
メンテナンスによって大幅に評価方法が変わったよ！！！！	時の権能者
なうろう作家とメガミ様	昼熊
ざまぁ・追放　いざ書く側に回ると立ちはだかる常識の壁	射手川
ツバメの雛さまが巣から落ちてこられたのでお育て申し上げた件	けも
なぜ追放、ざまあがランキングを席巻するのか？　短時間消費型コンテンツ化する「小説家になろう」と、新人作家への提言	長谷川凸蔵
書籍化の打診が来ています　－出版までの遠い道のり－	ダイスケ
なろう小説はこれだから嫌いだ！　とお嘆きのあなたに。ランキング以外の作品の探し方、お伝えします。	すー
熊エッセイ2022	熊ノ翁
助けてもらう側なのに、どうしてそんなに偉そうなんですか？	ホーリョ
警察に捕まりました　～そして、現代社会の闇を見た～	仙道アリマサ
小説家になろうができる前から活動している私が、小説家になろうが流行る前に活動休止して最近復帰して思う今と昔	沢野いずみ
異世界でマヨネーズ無双をしようとした結果	高井うしお＠百花娘々10／17コミック発売
底辺作者集まれ～ 目指せ脱0pt！ なろう連載投稿時間のススメ	笹座 昴
誤字報告機能ありがたいけど、要点だけ書いて欲しい……！	港瀬つかさ
『小説家になろう』の『ボーイズラブ』タグって意味あるの？	三谷玲
読みたくない作品？ えっ、読まなければいいだけでは^q^	Kei.ThaWest
不毛な喧嘩、不毛な努力、ここが変だよ“なろう界隈”	冬月光輝
銀河英雄伝説論　大人になってから分かるヤンの非常識さ	加藤　良介
『なろう用語の基礎知識』第七稿	ξ˚⊿˚)ξ ただのぎょー
誰でも分かる！小説の書き方入門	青い鴉
解明され始めた新型コロナの本当の死因のメカニズム　～ウィルスそのものが人を死に至らせるわけではなかった～　期待される日本株BCGとは？	御代出　実葉
富岳の世界一速いスーパーコンピューターという表現は厳密には正しくない。正確には現時点にて世界一高速処理できるサーバーである。	御代出　実葉
沖縄人が騙る中国脅威論と法案反対派への反証	粛
小説家になろう　あなたが信じる『評価数』・『ブックマーク数』を――『ぶっ壊す』。２０１６改訂版	森永ピノ子
誤字報告機能という紙アプデがきたああああああ	ひょろ
最近の『小説家になろう』のランキングについて、いくらなんでもこれは酷いと思ったしがない作品投稿者の怒りと憤りの話	佐々木鏡石@『じょっぱれアオモリの星』12/28書籍発売
【作者様にお願い】まずは登場人物の名前をググりましょう！！	琥珀
ライトノベルは衰退しました！	熊ノ翁
俺の作品に１：１とか２：２とかふざけた点数をつけたクソどもへ。	ZUZU
ブクマ外しの悲しみを全世界に訴えるうた	黒塔真実
書籍化さえしなければ、君は今でも書き続けていただろうか？	しゃもじ
0pt小説は砂漠であり、愉快な旅でもある	岬林　守
吾輩は猫である。名は既にあるのだが、まだ増えるもよう。	夕立
ブクマはがされ川柳	殿水結子
盗賊の娘	りったん
なろうの星	小さい星の住人
烏になった母鳥	三香
なろうあるある川柳	殿水結子
嘘つきの告白	うわの空
異世界転生あるある川柳	暮伊豆
ママさんなろう作家あるある川柳	殿水結子
エタるな危険	はいおく まんたん
＊あるオタクから一般の人へのお願い＊	桜井あんじ
subtle	水野葵
死ねば感動するんだろう？	トネリコ
退会	ひだまりのねこ
『小説家になろう』でなかなかアクセス数が伸びない貴方に	Past (菊川睡蓮)
なろう学園☆底辺組！！　オープニング	戸森鈴子
なろうで長編は不遇だぞ川柳	殿水結子
春が来れば、いなくなる	みこと。
誰かの心に刺さっているんだ！	椎名ユズキ
誤字報告の詩（運営さんへ捧ぐ詩）	闇黒猫虎
ワクチン接種あるある川柳	殿水結子
詩集（うたあつめ）	藤乃 澄乃
椎名ユズキ 詩集〜月のうさぎ	椎名ユズキ
異世界で楽しく平和な学園生活を送るために贈る言葉	たなか
だから俺はエタらせる	間咲正樹
ぱりぱりぱりり	みこと。
なろうスコッパーあるある川柳	殿水結子
ただ風に揺れるのを見ていたい	水渕成分
底辺作家あるある川柳	殿水結子
書籍化作家あるある川柳	殿水結子
とおのみち	暮伊豆
ブックマークが減った時	椎名ユズキ
桜吹雪	中村尚裕
みんなすごい人	平民のひろろさん
メッセージ・イン・ア・ボトル	ξ˚⊿˚)ξ ただのぎょー
そんな私を許してね	みこと。
深呼吸	なななん
恋は花火のように	しましまにゃんこ
失敗しろ	たらこくちびる毛
言いたいけど、言いたくないねん	秋の桜子
ブクマ押しちゃう川柳	殿水結子
らびゅー	鞠目
愛あらば微笑まん	香月よう子
大好き！	七生
途切れ道	暮伊豆
孤独な男	暮伊豆
NW3リプレイ『転生者症候群』	鰤／牙
もし三國志の呂布がアリストテレスの倫理学を学んだら	かずさん
アリアンロッドRPG2Eリプレイ・友情は闘いの果てに咲くものですよね！	巻野ぐるぐる
『なまこ×どりる』TRPGリプレイ！（嘘）	ξ˚⊿˚)ξ ただのぎょー
ソードワールドTRPGリプレイ　～狼少年はさかまく螺旋の少女に出会う～	狼子　由
ボク達生活冒険者	シムCM
百錬の覇王、異世界魔王、オバロの違いから何が許され何が許されないか調べてみた	ラピさん
そしてみんなどこへいった	アホリアＳＳ
SW2.0リプレイ『穢れの酒を飲む方法』	仙茶
おっさん牛丼史　	愛猫家　奴隷乙
ログ・ホライズンＴＲＰＧリプレイ『破滅の鍵をとりもどせ！』	相馬将宗
二人の英雄だけが知っている	Shoot
ドラゴンアームズ改リプレイ『オペレーションアンカーブレイク』	グリップダイス
ᓚᘏᗢ　猫ギロチン～ＲＰＧ風ある日の出来事～　ᗢᘏᓗ	山目　広介
TRPGリプレイ小説～GMの胃は死んだ編～	極振り大好きおじさん
トーキョーＮ◎ＶＡリプレイ　グリップダイス的日常	グリップダイス
アリアンロッド2E・リプレイ・ビギナーズ　LV1「この鍋には肉がないっ！」	黒兎そよ
んもーっ！　どうして水平射撃だと凄いのか――クロスボウは水平射撃をしてない	curuss
ソード・ワールド2.0リプレイ「ご主人様はウサギですか？」	グリップダイス
僕らのSW2.0リプレイ～すぐに終わった冒険～	林田草男
ソード・ワールド2.0布教用リプレイ　『ミストキャッスル　－蛮都からの生還－』	神楽風月
ログ・ホライズンTRPGリプレイ　あの景色を見たくて	CUTLET
ソードワールド2.0リプレイ・無法都市ナインテイル	SHIN12
霊は家屋に宿るもの？（タマゲッターハウス：リプレイの怪）	アホリアＳＳ
アリアンロッド２Ｅ・リプレイ・ダイジャスティス	ちありす
ダブルクロス キャンペーンリプレイ:レネゲイドウォー	御巫咲絢
とあるネット記事に感じたこと	愛猫家　奴隷乙
メタリックガーディアンRPGリプレイ　『蕾よ花開け』	りょーさん
アリアンロット２E・リプレイ「対決！シリアルキラー！！」	烏妣 揺と愉快な仲間たち
血風領のニューフェイス	鏑木ハルカ
西部劇マギシューキャンペーン	細目魔王
メタリックガーディアンRPGリプレイ	黄粋
リサイクルを発展させるには	百（難しい童話）
知らぬが仏？　　知らないってこと程、怖いことはない？　　あるアメリカ女性の実話です。「改訂版」	観不思議境　非想天
その恋、応援します！！	秋元智也
聖女の年齢制限	くれふじ
プログラム小説『javascriptでプログラム小説を書こう！』	ぼっけんさん
半生ゲーム	池戸悠
人災派遣TRPGリプレイ	紫電改
SW2.5　リプレイ　奈落の大迷宮〈アビス・ラビュリンス〉	baia=vira
果てなき世界	葉月みつは
本の虫	夕野紅葉
星のない空に輝く光を～オリーブ色の六等星～	采火
思い込みで自分を最強と化したお兄ちゃん（３０歳）が魔王討伐で無双し始めます（イラスト付き）	ぷれみあむ猫パンチ
うぁぁぁーお！寝過ごした	秋の桜子
モノトーンミュージアムRPG「Cage」キャンペーン	雛盛つくね
視界が豊かになりますように	弥禾
ガーデンオーダーリプレイ『風見鶏、炎上』	グリップダイス
【SW2.0】虹夢亭【キャンペーンリプレイ】	赤星
最強走り屋決定戦！！！！	石田　昌行
異世界コンサル株式会社（旧題：冒険者パーティーの経営を支援します！！）	ダイスケ
魔王軍最強の魔術師は人間だった	羽田遼亮
出ていくのも『優しさ』ですから	さおん
よし、逃げましょう	RIN
《書籍1巻発売中》神様の予言書『俺の未来がアニメでは雑魚死だったので拒否します』　旧題『悪役もみんな生きている』	語部マサユキ
最近のなろう読者の質低下が半端ない件　終幕	さとうカンパニー
勇者「魔王倒したし帰るか」	湯葉
準備万端な異世界召喚	優木凛々
悪役令嬢、必要ないからと追い出されたら国が滅びました。	ポンキチ
【完結】覆水盆に返らず～最悪な初対面なのに好きになるわけない！後悔してももう遅い！～	みなと
ある悪役令嬢からの手紙	端野ハトコ
わたしが悪女と罵られることになった理由	あさな
僕の諭吉おじさん	greed green/見鳥望
【無双】底辺農民学生の頑張り物語【してみた】	カズキ@積みディスク消化中
そんなつもりはなかった？　ではどういうつもりだったのですか	猫宮蒼
あなた、だれ？	十蛇秋紅
上位種に転生出来るらしいので、前世の母国を滅ぼすことにする	燦々SUN
字書きが筆を折りそうになった話	まきぶろ
聖女と呼ばれた悪役令嬢	りったん
【本編電子書籍＆POD化】神様のドＳ!!　番外編置き場	藍上イオタ
氷の滅慕	SH
大丈夫だよ、僕はずっと側にいるよ	棗
あなたが母親の手料理を食べられる回数は、残り328回です。	うわの空
ざまぁするのが悪役令嬢だけとは限らない件	猫宮蒼
ざまぁはとっくに終了しました	猫宮蒼
最近のなろう作者の質の低下が半端ない件	木工職人
【書籍化しました！】鉱石令嬢～没落した悪役令嬢が炭鉱で一山当てるまでのお話～	甘味亭太丸
夫は愛人に夢中ですが、私は気になりません	ひつじかい
いきなり原作を変えてしまって、すいません。　～少年マンガの世界に転生しました～	浅葱零
小説家になろうが冒険者ギルドだったら	昼熊
魅了魔法の正しい使い方	馬場翁
大嫌いな令嬢	緑谷めい
エルサティーナの笛吹姫	小択出新都
なろうの異世界ものを語るスレ	ID:dt30++/6
愛するが故に	ひつじかい
婚約破棄からの国外追放でざまぁとかもう遅い	大貞ハル
０から始める小説の書き方徹底講座！	N.M.ぺんくらぶ
婚約破棄された娘は死んだ婚約者に復讐をする	更科　郡
転生しました。乙女ゲー世界の悪役令嬢――――――の取り巻きその３に。	新田　葉月
こんなのは「小説家になろう」じゃない！	たこす
因果はめぐる	田中
ゲームの通りなん・です・が……	嘉胡きわみ
友情とかないです	猫宮蒼
転生喪女の異世界暮らし～魔法と商売、一番最後に恋愛を～	灰猫
王子が婚約破棄宣言した結果	猫宮蒼
追放？　あぁ、契約解除って事ですね	猫宮蒼
え、今更？　手遅れに決まってるじゃないですか	猫宮蒼
巻き込まれた僕達は	波留まち（Halmachi）
こんにちは赤ちゃん	いときりばさみ
原作改変に臨んだ結果	猫宮蒼
ログ・ホライズン	橙乃ままれ
多神の加護	masanimasa
先代勇者は隠居したい(仮題)	タピオカ
風と異邦の精霊術師	山際小道
第三王子エルメル	せい
盟約の花嫁	徒然
義妹が勇者になりました。	縞白
腕白関白・改定版	そる
地面を愛した男	もりぶりん
遅咲き冒険者（エクスプローラー）	安登　恵一
チート薬師の異世界旅（旧題:神様？チート異世界転移で薬師旅）	赤雪トナ
異世界の愚か『もの』　～世界よ変われ～	ahahaha
New　World 	池宮樹
魔法使いと風精霊	田中２３号
ウルフバレル５．５６	土田ナオ
その女、悪女です！　いいえ、それは濡れ衣です。	サディラ
水の理	古流　望
異世界行商譚	あさ
地味な青年の異世界転生記	鵜　一文字
裏切られた勇者のその後……	飯田栄静＠市村鉄之助
迷宮世界グリンドワールド	吉岡
蝉だって転生すれば竜になる	あぶさん
俺の人生ヘルモード	侘寂山葵
塔の上の悪役令嬢	相川イナホ
ちぇんぢ！！	草加人太
転生したった　	空乃無志
アルテナの箱庭が満ちるまで	赤野用介
攻略なんぞされてたまるか！	井平遼
ゲームの世界で第二の人生！？	シェイフォン
撃ち抜いたのは	歌瑞
ギリギリアウトかもしれない異世界	kameo
脇役勇者は光り輝く	三嶋　与夢
異世界ツーリング	おにぎり
ROBOT HEART 【1】	Cat Bell
異世界紳士録	ガー
刹那の破片	緑青・薄浅黄
チートだけど宿屋はじめました。	nyonnyon
死が二人を分かつとも	秋月
別の世界で生きていく条件	招きダンボー
結構ハードな乙女ゲーの世界	ニネコ
望まない結婚	小鶴
ダンジョン発掘物語　	Ｙ．Ａ
『勇者』の反逆	本場匠
異世界で生活することになりました	ないとう
剣と魔法の世界なんて、現代技術の敵じゃない！	一八四
異世界で生きていく方法	神野光典　（旧　こでんかんの）
WILD FRONTIER ～虹色異世界冒険譚～	シーサイド地蔵
鈍色のパラディン	チノフ
クライ・フリーダム	力野　十三
ああ勇者、君の苦しむ顔が見たいんだ	ユウシャ・アイウエオン
