name	writer
君を守るため、僕は何度でも死に戻る	羽田遼亮
人類を滅ぼすシミュレーションゲーム	えるえる
心を読む聖女	水紅
太宰治、異世界転生して勇者になる　～チートの多い生涯を送って来ました～【連載版】	高橋弘
ギルドカードの遺言	えるえる
世界一簡単な合法殺人	下城米雪＠ワンオペ解雇コミカライズ連載中
私が犯した罪について	たなか
食べログ1.8のラーメン屋	村崎羯諦
ネコチャンと天国で会う時の注意点	ヒロモト
１０年不倫	青井青
バカだけを殺すウイルス	えるえる
徒然ww	京野うん子
愚者の独白	高槻いつ
転性のノスタルジア	都森メメ
先月お父さんが誘拐されたけど、身代金はまだ支払ってません	村崎羯諦
【２】宮廷書記官リットの有閑な日常	鷹野　進
耳の聞こえない風俗嬢	青井青
わたしが勇者の残機ドナーに登録した理由	志雄崎あおい
共鳴する	はなぶさ
王子と王女の婚約締結	ほねのあるくらげ
もう、いらない	三香
隣の芝生は枯れていた	あなぐらグラム
親子鑑定	青井青
目的は生き延びること	大菊小菊
男なら一国一城の主を目指さなきゃね	三度笠
え、社内システム全てワンオペしている私を解雇ですか？【書籍化・コミカライズ】	下城米雪＠ワンオペ解雇コミカライズ連載中
百花宮のお掃除係～転生した新米宮女、後宮のお悩み解決します。	黒辺あゆみ
今更自由といわれても	西木田
【12月15日書籍発売】公爵夫人の秘密の日記――白い結婚を申し入れたら、渡りに船と言われました。	横浜 山笑（旧山笑）
がんばって最高の遺書を書いたら、なぜか &quot;ざまあ&quot; することになりました	優木凛々
周囲が羨む「ツンデレ幼馴染」を捨てるのは間違っているのか	まきぶろ
大陸英雄戦記	悪一
【短編版】婚約破棄を宣言した王子と、悪役令嬢は階段から落ちた·····そして2人は叫んだ「私達、入れ替わっている！？」と	夕景あき
冤罪令嬢の肖像画～とある画家が人生最高の肖像画を描いた話～	優木凛々
素人おっさん、転生サッカーライフを満喫する	ハーーナ殿下
最凶侯爵の逆鱗に触れた者達の末路	やとぎ
美人な妹と、私	ユウキ
婚約者が高貴なご令嬢と愛し合ってるようなので、私は身を引きます。…どうして困っているんですか？	越智屋ノマ 
夢から醒めて	あさな
逆行転生したおじさん、性別も逆転したけどバーチャルYouTuberの親分をめざす！	ブーブママ
メニューをどうぞ【WEB版】	雛／汐邑雛
期待されなかった僕たちは	瀬嵐しるん
後妻のお義母様とお義姉様が屋敷に来て、私は何故か幸せになりました。	浅村鈴
純粋な疑問の方が酷なこともある	海狸
悪役令嬢、庶民に堕ちる【web版】	緋月紫砲
別に要りませんけど？	ユウキ
男女比がぶっ壊れた世界の人と人生を交換しました	もぎ　すず
【web版】美少女にTS転生したから大女優を目指す！【書籍化】	武藤かんぬき
義妹の嫌がらせで、子持ち男性と結婚する羽目になりました。継母として、義理の娘に嫌われることも覚悟していましたが、そこでようやく本当の家族を手に入れることができました。	石河 翠
【書籍&amp;コミック発売中】余命六ヶ月延長してもらったから、ここからは私の時間です	編乃肌
やり直してもサッカー小僧	黒須　可雲太
おっさん、転生して天才役者になる	ほえ太郎
アラサーのオレは別世界線に逆行再生したらしい	翠川稜
気が付いたら競走馬に生まれ変わっていました。でも、競馬の知識は０なんです！	南辺万里
冷遇妻だけど、夫に愛されていたようです。知るか。	瀬尾優梨
そんな俺は、廃太子。《　転生王子の逃避、あるいは　安寧への力業　》	龍槍　＠　リハビリ中
異世界チート知識で領地経営しましょう	加藤　良介
ないがしろにされた令嬢は、不幸の元凶を排除することにした	優木凛々
晴れて国外追放にされたので魅了を解除してあげてから出て行きました	ラララオキ
エルフさんの魔法料理店	夜塊織夢 
鈍金色のリリーフエース〜常勝球団で酷使されていた俺は、弱小球団のホワイト環境で無双する〜	筆箱鉛筆
とある魔球のダウンザライン！	うるめいわし
聖女追放！………とは直接関係なかった子爵様	ハーピスト 
【書籍・漫画化しました！】異世界メイドの三ツ星グルメ ～現代ごはん作ったら王宮で大バズリしました～【旧題・美食おぼっちゃまの転生メイド】	モリタ
いつか貴女の手を引けるように。	黛ちまた
辺境伯子息の独白	里見しおん
おおそといっき！	うるめいわし
【短編】国王陛下は王子のフリを見て我がフリを反省した	宇水涼麻
婚約破棄は別に良いのですが、貴方が自慢げに見せているそれは国家機密ですわよ？	はぐれメタボ
アラサーがVTuberになった話。	とくめい
婚約者に裏切られた私は熊より強くなりました	秋雨ルウ（レビューしてた人）
真実の愛に婚約破棄を叫ぶ王太子より更に凄い事を言い出した真実の愛の相手	ラララオキ
初夜に「俺がお前を抱く事は無い！」と叫んだら長年の婚約者だった新妻に「気持ち悪い」と言われた上に父にも予想外の事を言われた男とその浮気女の話	ラララオキ
戦国小町苦労譚	夾竹桃
戦国時代に宇宙要塞でやって来ました。	横蛍
偽典・演義　～とある策士の三國志（仮）～	仏ょも
淡海乃海　水面が揺れる時	イスラーフィール
転生！　竹中半兵衛　マイナー武将に転生した仲間たちと戦国乱世を生き抜く	青山　有
羽林、乱世を翔る（異伝　淡海乃海 水面が揺れる時）	イスラーフィール
三日月が新たくなるまで俺の土地！～マイナー武将「新田政盛」に転生したので野望MAXで生きていきます～	篠崎冬馬
戦武成伝　－武田に転生したと思ったら想像してたのと違う甲斐武田から枝分かれした安芸武田のさらに枝分かれの若狭武田だったので、滅亡しないように武をもって成り上がります－	尾羽内 鴉
【書籍化】令和の化学者・鷹司耀子の帝都転生　～プラスチック素材で日本を救う～【旧題：鷹は瑞穂の空を飛ぶ】	雨堤俊次/コモンレール
本能寺から始める信長との天下統一  ©歴史知識は必要なし ９巻２月２５日発売 オーバーラップ文庫 電撃大王連載中  電撃コミックスNEXT ３巻10/27発売・１８１，０００，０００PV突破	常陸之介寛浩★ＯＶＬ５金賞受賞☆アルファ第4回歴史時代小説読者賞
銭（インチキ）の力で、戦国の世を駆け抜ける。（本編完結）（コミカライズ開始）	Ｙ．Ａ
ルイ16世に転生してしまった俺はフランス革命を全力で阻止してアントワネットと末永くお幸せに暮らしたい【WEB連載版】	スカーレッドG
【漫画単行本発売中】斎藤義龍に生まれ変わったので、織田信長に国譲りして長生きするのを目指します！【本編完結】	巽未頼
織田家の長男に生まれました	いせひこ/大沼田伊勢彦
魯鈍の人（ロドンノヒト）  ～信長の弟、信秀の十男と言われて～	牛一（ドン）
加賀100万石に仕える事になった	シムCM
戦国生存記	現実逃避
陶都物語～赤き炎の中に～	まふまふ
【本編完結】小物武将、木村吉清　豊臣の天下で成り上がる！　(旧題)マイナー戦国武将に転生したのでのんびり生きようと思ったら、いきなり30万石の大名になってしまいました	田島はる
信長の庶子	壬生一郎
武田信虎　～暴君から名君へ～	なんじゃもんじゃ
冬嵐記	槐
戦国時代に転移したと思ったら俺だけRPGだった！	したらば
じゃない孔明転生記。軍師の師だといわれましても	二水うなむ
項羽と劉邦、あと田中	古寺谷 雉
未来から吹いた風　～５人でひっくりかえす太平洋戦争～	青雲あゆむ
痛快娯楽時代劇　小田氏治	藤永太郎
三田一族の意地を見よ	三田弾正
復興名家の仮名目録　～戦国転生異聞～　（旧名：殿と仮名目録の追加案件）	シムCM
風神天翔記　～とある修羅の転生事情～	仏ょも
海道一ノ弓取リ	葉室 貫之
討ち死になんて勘弁な	悠夜
貴族になったが、未来がヤバかった	やがみ
信長公弟記～織田さんちの八男です～【コミカライズ連載中】	彩戸ゆめ
天地海　～無名武将に転生したので天下は諦めて新潟港を発展させる～	今川幸乃
稲荷様は平穏に暮らしたい	茶トラの猫
北政所様の御化粧係〜戦国の世だって美容オタクは趣味に生きたいのです〜	笹倉のり
生まれ変わったら曹昂だった。　前世の知識を活かして宛城の戦いで戦死しないで天寿を全うします	 雪国竜
航空エンジニアのやり直し　～航空技術者は二度目に引き起こされた大戦から祖国を守り抜く～	御代出　実葉
董卓の娘	神奈いです
転生三法師の奮闘記  ～魔王の孫とよばれて〜	夜鷹
六芒星が頂に～星天に掲げよ！ 二つ剣ノ銀杏紋～	縞杜コウ(縞守皐駕)
江雲記―六角定頼に転生した舐めプ男の生涯―	藤瀬慶久
戦国蒸溜所 ～スピリッツ・オブ・バトルエイジ～	漸減サカヤキ
悪役令嬢の十五年戦争　 ～転生先は戦前の日本？！　このままじゃあ破滅フラグを回避しても駄目じゃない！！～	扶桑かつみ
時霞　～信長の軍師～　【長編完結】	水野忠
【文庫化】信長と征く　転生商人の天下取り	入月英一
阿武隈の狼	平良中
首取り物語：北条・武田・上杉の草刈り場でザマァする。ところでみんな・・・・現実を見ようか。こいつらの首取るのは大変なんだヨォ～～～！主人公以外全員ガチです。	天のまにまに
オール・ユー・ニード・イズ・吉良～死に戻りの赤穂事件～	左高例
薬屋のひとりごと	日向夏
婚約破棄の日の夜に	夕景あき
吾輩は魔王であるが、四天王になぜか監禁されている	コーチャー
勇者が死んだので三等書記官は魔王城へ行きます	コーチャー
伯爵夫人の遺書	水谷繭
異世界の名探偵（旧題:ファンタジーにおける名探偵の必要性）	片里鴎(カタザト)
彼ぴっぴしゅきしゅきビーム殺人事件	経済的ゾンビ
レベル１の俺が魔王を倒すと言ったら、みんな笑った。でも、前世が名探偵だったおかげで本当に倒してしまい……	からくらり
聖女様を殺したのは誰ですか？	コーチャー
誰が聖女を殺したか？	榛名丼
勇者一行は死ななければならない	コーチャー
佐伯さんの下着が透けてることを後ろの席の僕だけが知っている〜ところで佐伯さん、毎日帰り際にボソッと下着の色を教えてくるのはなんでなの？〜	麻田セカイ　
王子様は一級死亡フラグ建築士　～城からパクってきた銀のスプーンが黒く変色した件～	藤原ゴンザレス
『飽きた』と書いた紙で異世界に行けたけど、破滅した悪役令嬢の代役だった	枝豆ずんだ
盲目の織姫は後宮で皇帝との恋を紡ぐ	小早川真寛
最高の勇者を殺す一つの方法	コーチャー
時計屋の兎（ラビット）	狭山ひびき
勇者様の死体を見つけちゃったんですけど！	コーチャー
マネーロンダリング～二億円の行方	青い鯖
《連載》ヒロインは途中退場させられましたが、全て元に戻るだなんて、そうは問屋が卸さない	きなこ
キモオタでギャルゲー、それって何の罰ゲーム！？	天満川鈴
囁くヴァニタス	中村 颯希
死に掛け女のぐーたら疫神生活	楠瑞稀
劣等刑事の勘違い逮捕伝　～車で犯人ひきまくってたら出世しました～	馬路まんじ＠PV公開（主人公：赤羽根健治 ヒロイン：逢田梨香子）
【コミカライズ連載中】塔の医学録　～悪魔に仕えたメイドの記～	澁澤まこと
呪われるたび強くなる。スキル『呪具耐性』を授かりました。あれから十数年、名家から追い出された貴族の次男坊。ひとり身おっさんのもんもんスローライフ。	三神カミ
【書籍化、コミカライズ】《第三章完結》愛読家、日々是好日〜慎ましく、天衣無縫に後宮を駆け抜けます〜	琴乃葉
ギルドの受付嬢は人間を殺せない	コーチャー
絶体絶命悪役令嬢	8D
逃走犯はオトコノコ！	青い鯖
異世界クイズ王　～妖精世界と七王の宴～	ＭＵＭＵ
本気で「偽善者」はじめたら、たくさんの人に感謝され、なりゆきで巨大犯罪組織まで壊滅させ、いつの間にか世界70億人の命を救ってたんだが。	実時 彰良
王国の令嬢が帝国に嫁入りするのは、戦争回避のため	白澤　睡蓮
血みどろの婚約破棄は仕組まれていた	白澤　睡蓮
その事件の１人目の被害者は、悪役令嬢である　～サスペンスな世界に転生したら、婚約者か弟か殺人鬼に殺されそうです～	宮崎
アラサーがJKに転生して楽しいのか？	別所 燈 
ステータスが見えるようになった俺は君を絶対に救い出す！　～俺と天使の事件捜査ファイル～	藤原ゴンザレス
イレギュラーな魔術師（旧版）	常高院於初
正しいアイコラの作り方	水月一人
殺人遺伝子	菱川あいず
聖女殺しの婚約者	浮夜海月
人狼メイドはブラック法廷に異議を申し立てる	今際之キワミ
【短編】「また異世界誘拐が流行り始めたんだってよ！」	まほりろ／若松咲良
探偵など要らない学園生活	塚山　凍
勇者の悲劇	コーチャー
異世界医院〜一期一会〜	モロ平野
【書籍化】後宮の嫌われ白蛇妃ですが、推しのためなら悪意も美味しくいただきます！ 〜えーっと、殿下は推しじゃないです。なので溺愛はご遠慮ください〜	碧水雪乃＠『嫌われ白蛇妃』スターツ出版文庫から1/27発売
ギルドの受付嬢は空を見上げる	コーチャー
姫様また誘拐されたんですか	コーチャー
推理令嬢シャーロットの事件簿～謎解きは婚約破棄のあとで～	あけちともあき
オカルトちゃんねる【連載版】	lpp
婚約破棄の行方	彩戸ゆめ
ホラー映画の幼女が魔王の元に召喚されました。	エノコモモ
 クラス転移とか無理なので	芍薬甘草
「真の聖女様、ですか？　ええ、もちろん歓迎いたしますよ」	わんこそば
見たら絶対に死ぬ”呪いのビデオ”を手に入れたのに、幻のマイナー規格”HD-DVD”に録画されてるせいで再生できません（泣）	大萩おはぎ
娘が「悪役令嬢」に憑り殺された日。あるいは、あの子が死んだ日の話	紫苑
今更「許せ」と言われても	アンドレイ
ただひたすら走って逃げ回るお話	残念無念
ゆるコワ！　～無敵の女子高生二人がただひたすら心霊スポットに凸しまくる！～	谷尾銀
召喚聖女の落とし穴	江葉
死刑囚、魔法学校にて教鞭を振るう	無道
神田、おれだよ	ナチ
山内くんの呪禁の夏。	二宮酒匂
クラス全員からいじめを受けている僕は絶対呪われる駅の連絡通路に凸して実況ムービー撮ってきます。	闇黒猫虎
その悪役令嬢は壊れている	伊藤@
【書籍化】妹がいじめられて自殺したので復讐にそのクラス全員でデスゲームをして分からせてやることにした	駆威 命（元駆逐ライフ）【書籍化】妹がいじめられて～発売中
クラス一の美少女が、駅ホームで不思議な踊りを踊っていた	BAWさん
【悲報】時間停止モノAV、９割がヤラセだった	大萩おはぎ
生存者インタビュー	青井青
名前のない怪物	黒木京也
自分がオカズにされた回数が分かる女の子	ヒロモト
ある悪役令嬢への手紙	端野ハトコ
引きこもりだけど、外にゾンビがうろついている	上野羽美
悩める王子と呪いの言葉	長月 おと
悪役令嬢の処刑の、その先は。	しののめ。
ブレーメンの屠殺場	NiO
幼馴染が吊り橋効果を狙って肝試しに行こうと誘って来たから、全部の心霊現象解明してムードもへったくれもない状態にしようと思う	玄武聡一郎
【連載版】御気の毒ですが、呪いが発動しました	猫田 トド
乗っ取られたら乗っ取り返せばいいのですよ、王妃さま。	牧村 多希
もしもサイコパスがデスゲームに巻き込まれたらこうなります	無道
絶対に逃げられない最恐の異世界”きさらぎ駅”の謎を解いて脱出します！	大萩おはぎ
怪異の掃除人	長埜 恵
ループ100回目の悪役令嬢ですのでお望み通りヒロインいじめてみました	にょん
底辺貴族で【スライム召喚】しか出来なくて美少女にイジメられてた俺、キレて顔面に召喚魔法を使ったら脳みそを乗っ取ることに成功　～バレたらやばいので奴隷にした美少女にヨイショさせながら権力を手に入れます～	馬路まんじ＠PV公開（主人公：赤羽根健治 ヒロイン：逢田梨香子）
ヤクザな退魔外伝　神無沼	モロクっち
いきなり、ただの肉屋に騎士がきた	伊藤@
婚約破棄を回避した悪役令嬢は今日から幸せになります。だから、	紫苑
もう人間くらいしか食べる物がないこの世界で、どうして僕らは出会ったのだろう	帰初心
【復讐譚】お姉様に差し上げますわ	茅野ガク
断罪の魔女	ゆうき
亡くなった妻が駅のホームで線路の方に引きずり込もうとしてくる件。	闇黒猫虎
うそつきの子〈山内くんの呪禁事件簿〉	二宮酒匂
悪役令嬢の独白	碓井桂
最近、死神が追いかけて来る夢を見ます。毎晩少しずつ距離が縮まって、次はもう逃げ切れそうにありません。	大萩おはぎ
転生して名もなき雑草になりました。正式名称はアランフィオレンティーナといいますが、誰も呼んでくれません	三香
守護霊（？）は鎌倉武士	ほうこうおんち
本当は怖い異世界物語	馬渡
ヒロイン達が全員俺のことを生理的に無理な話	夜明
顧問の先生が素手で幽霊を殴るんだが、どこかおかしいのだろうか？	くろぬか
リビルドワールド	非公開
マヌケなFPSプレイヤーが異世界へ落ちた場合	地雷原
【書籍第2巻10/5発売！】わしジジイ、齢六十を超えてから自らの天賦の才に気付く【コミカライズ】	しんこせい(『お助けキャラ』1巻2/24発売！)
コボルト無双 ❧ |樹|º▿º*) ̖́- 最底辺のかませ犬が征く!	shiba
異世界支配のスキルテイカー　～　ゼロから始める奴隷ハーレム　～	柑橘ゆすら
異世界ＳＦ！　ＦＰＳ！　『カラフ撤退戦』	黒色粉末
【収納空間】を極める男　～モンスターを狩りたいので誰よりも【収納空間】を使い込んでいたら、色々な事件に巻き込まれてしまう。『俺はモンスターを狩りたいだけなのにぃ！』～	森たん
失格王子の成り上がり冒険譚～出来損ないはいらないと王家を追い出された俺、規格外の『器』で世界最強の冒険者になる～	未来人A
12ハロンのチクショー道【書籍化】	野井ぷら
人型巨大兵器〝に〟転生しました〜冷凍世界再点火〜	白色矮星
俺の家が魔力スポットだった件～住んでいるだけで世界最強～	あまうい白一 
引き籠もりヒーロー	(*■∀■*)
エルフに転生した元剣聖、レベル１から剣を極める -Hero Swordplay Breakdown-	大虎龍真
外れスキル『予報』が進化して『言ったら実現』になる件☆レンガ・レンガ・レンガ！でスローライフしてます	天野優志
チートスキル『死者蘇生』が覚醒して、いにしえの魔王軍を復活させてしまいました〜誰も死なせない最強ヒーラー〜	はにゅう@『木の実マスター』発売中！
アルケミスト・スタートオーバー ～誰にも愛されず孤独に死んだ天才錬金術師は幼女に転生して人生をやりなおす～	エルトリア
迷宮で石ころは光り輝く	乙黒
イマドキのサバサバ冒険者	埴輪庭
啼かないカナリアの物語　～ 声を出せない魔法使いと模造の小鳥の探しもの ～	綾村実草【カナリア第一巻発売中です！】　
希望のクライノート　～魔法戦士は異世界限定ガチャを回す～	オスカる
『灰色乙女の流離譚』　私は自分探しの旅に出る【完結】　	ペルスネージュ
王宮の仕事を追放された魔導具使いの俺は幼少期の男の友情を信じて昔の仲間たちに集まってもらったらなぜかハーレムパーティになっていた。今更戻れと言われても…やっぱ遅くね？	LENA
【最終章開幕】傷跡の聖者	イエニー・コモリフスキ
勇者代理なんだけどもう仲間なんていらない	ジガー
[完結しました！] 僕は、お父さんだから（書籍名：遺伝子コンプレックス）	舛本つたな
鋼鉄のアイ	大紀直家@パブロン
召喚世界のアリス	天野ハザマ
婚約破棄されたので全員殺しますわよ ～素敵な結婚を夢見る最強の淑女、２度目の人生～	とうもろこし
魔導機人アルミュナーレ	凜乃　初
 英雄《しゅやく》になれない槍使い	笹木さくま（夏希のたね）
魔法少女のヒーロー	てふてふてふ
ラドゥと旅路と獣狩り	あびすけ
帰還者《リターナー》は平穏に暮らせない	幽霊@ファベーラ
ラグナロク	安井健太郎
勇者の称号を剥奪されたおっさん、これ幸いとバカンスに行った先で魔王さんと遭遇する　～夏のあばんちゅーる～	ぽんこつ少尉
出涸らし王子と悪役令嬢――ＶＲＭＭＯＲＰＧの世界に転生したかったのに、乙女ゲーの世界で悪役令嬢の婚約者をやっている僕	成瀬真
骸鬼王と、幸福の花嫁たち【第9部、二日置き更新！】	雨宮ソウスケ
黄金の国の狩人	神誠
白銀のヘカトンケイル	北十五条東一丁目
【完結】国賊王女のサーバントに転生したら、特殊スキル「武器庫（アーモリー）」が覚醒しました！	石和￥
C級師匠のS級冒険者育成計画	風緑
石ころ冒険者	亜蒼行
ハーフ・ヴァンパイア創国記	高城@SSK
青年と犬と、もう一人	Schuld 
たとえ夜を明かすのに幾億の剣戟が必要だとしても【Web版】（書籍版タイトル:幾億もの剣戟が黎明を告げる）	御鷹穂積
チートを拒否した最強魔術士。転移先で無能扱いされるが最強なので何の問題もなかった	やとぎ
日常系アニメとカマキリ拳法〜武術を身につけた最強のアニオタが、無双しながらアニオタライフを楽しむ話〜	魔人ボルボックス
私、竜の巫女の見習い！　今日もお仕事頑張りますっ！！	波多野まな
戦禍切り裂け、明日への剣聖 ⚔ The Knight Wizards!!	shiba
生産職を極め過ぎたら伝説の武器が俺の嫁になりました	あまうい白一 
即死チートが最強すぎて、異世界のやつらがまるで相手にならないんですが。【TVアニメ化決定！】	藤孝剛志
「第二王子が婚約破棄したってよ！」	八月 あやの
「いいか、ハーレムっていうのはな！」	八月 あやの
【書籍化】後宮という名の魔境をデスループで切り抜けてきたら、皇帝にブチ切れられました	かざなみ
【書籍化】廃公園のホームレス聖女	荒瀬ヤヒロ
大根ですが、おでんパーティから追放されました。パーティの野菜成分を俺が一手に担っていたんだが、大丈夫かな	ななみや
子どもが書いた夏休みの作文が、ファンタジーすぎる件	Aska
王太子に婚約破棄されていたら「ずるいずるい」という妹が乱入してきました。	荒瀬ヤヒロ
