name	writer
【奇跡のコミカライズ！】婚約者は私を捨てて妹を選びましたが、妹は時限爆弾でした【作者の日常も吹っ飛びました！】	関宮亜門
オットー・フォン・ハイデッカーはゲーム脳。	王石　勉
【書籍化・コミカライズ】偽・聖剣物語　～幼なじみの聖女を売ったら道連れにされた～	溝上 良
女神『異世界転生何になりたいですか』　俺「勇者の肋骨で」	安泰
そのガーゴイルは地上でも危険です　～翼を失くした最強ガーゴイルの放浪記～　	大地の怒り
親戚の小学生の算数の文章題がおかしい	唯乃なない
転生吸血鬼さんはお昼寝がしたい	ちょきんぎょ。
『男女比 １：３０ 』 世界の黒一点アイドル	ヒラガナ
クソ雑魚メンタルなTS娘はマッマの所為でVTuberデビュー	totto
ラスボスの向こう側～最強の裏ボス＝邪神に転生したけど、１０００年誰も来ないから学園に通うことにした～	天音のわる
「私って男っぽくてサバなのよね」誰なんだよ俺との見合いにサバを呼んだやつは	quiet
笑顔で魔力チャージ～無限の魔力で異世界再生	三木なずな
妹の配信に入り込んだらVTuber扱いされた件	江波界司
教会務めの神官ですが、勇者の惨殺死体転送されてくるの勘弁して欲しいです【連載版】	夏川優希
追放された聖女様は、とりあえず昼寝することにした	優木凛々
異世界で美少女になった俺、地球に戻れたので裏垢やってみる。	貯水庫
百万回転生した俺は、平和な世界でも油断しない	稲荷竜
裏側からこの状況を説明します	徒然花
転生して天才子役になってみたけど、もうやめたいです。	インド人を右に
となりの魔王	ナチ
異世界ガーデニング　－アルの造園物語－	乾物屋
超実力主義な勇者パーティ	優木凛々
古竜なら素手で倒せますけど、これって常識じゃないんですか？　（きょとん）	羽田遼亮
異世界召喚が多すぎて女神様がぶちギレました【連載版】	湯立向日/ガタガタ震えて立ち向かう
悪徳領主ルドルフの華麗なる日常	増田匠見（旧master1415）
俺は偽勇者～仲間と別れて早数年、なんか復讐されかけている～	藍澤 建
【短編】追放した回復術師が、ハーレムを連れて「ざまぁ」と言いに来た	夏目くちびる
最低皇子たちによる皇位争『譲』戦　～貧乏くじの皇位なんて誰にでもくれてやる！～	榎本快晴
「さあ、回復してやろう」と全回復してきた魔王様、ついに聖女に転生する	延野正行
冒険者「伝説の聖剣を手に入れた……よし売ろう！」	麦酒
夜道でいかにも幽霊っぽい女性を乗せたので、とりあえずコーナー攻めてみた	燦々SUN
多分僕が勇者だけど彼女が怖いから黙っていようと思う	花果 唯
クラス召喚されたけどそれどころじゃない	燦々SUN
その令嬢は祈りを捧ぐ	ユウキ
「これは契約結婚だ。君は何もする必要はない」と言い渡された侯爵夫人、「ただの契約なら複数と結んでも良くない？」と気付き片っ端からお飾り結婚契約締結、大惨事へ	quiet
義妹に虐げられる不憫姉の中身が悪女に乗っ取られた話	りったん
【短編】寡黙な戦士、追放に同調する～だって、もう遅いが見たかったんだもん～	大紀直家@パブロン
王子！　婚約破棄がどうとか以前に誰とも婚約できないまま学園生活終わっちゃったッスよ！	quiet
あなたが拾ったのは普通の女騎士ですか？　それともゴミクズ系女騎士ですか？	溝上 良
「一万人の男と寝た」と豪語する令嬢と結婚した僕、生まれた娘が僕と血は繋がってないことはもちろん承知してるけど、鑑定魔法で「娘の本当の父親が誰かは明らかにしておこう」と言ったら妻が猛烈に焦り始めた	エタメタノール
不死王の息子	日向夏
マンガを読めるおれが世界最強～嫁達と過ごす気ままな生活	三木なずな
シャングリラ・フロンティア〜クソゲーハンター、神ゲーに挑まんとす〜	硬梨菜
出遅れテイマーのその日ぐらし	棚架ユウ
新しいゲーム始めました。～使命もないのに最強です？～	じゃがバター
痛いのは嫌なので防御力に極振りしたいと思います。	夕蜜柑
【堂々完結】ブレイドスキル・オンライン　～ゴミ職業『サモナー』で最弱武器『弓使い』でクソステータス『幸運値極振り』の俺、いつのまにか『ラスボス』に成り上がります！～	馬路まんじ＠PV公開（主人公：赤羽根健治 ヒロイン：逢田梨香子）
＜Infinite Dendrogram＞-インフィニット・デンドログラム-	海道　左近
サモナーさんが行く	ロッド
Free Life Fantasy Online ～人外姫様、始めました～	子日あきすず
Only Sense Online	アロハ座長
『Curse Nightmare Party』-邪眼妖精が征くVRMMO	栗木下
未実装のラスボス達が仲間になりました。	ながワサビ64
骸骨魔術師のプレイ日記	毛熊
打撃系鬼っ娘が征く配信道！	箱入蛇猫
黄金の経験値【なろう版】	原純
Magica Technica　～剣鬼羅刹のVRMMO戦刀録～	Ａｌｌｅｎ
【書籍二巻発売中‼】お前のような初心者がいるか！　不遇職『召喚師』なのにラスボスと言われているそうです【Web版】	魚虎・瀧岡くるじ
ゲート・オブ・アミティリシア・オンライン	翠玉鼬
設定鍵インベントリア：シャンフロの諸々	硬梨菜
Frontier World ―召喚士として活動中―	ながワサビ64
射程極振り弓おじさん	草乃葉オウル
美少女になったけど、ネトゲ廃人やってます。	星屑ぽんぽん
職業、仕立屋。淡々と、VRMMO実況。	わだくちろ
ＶＲＭＭＯの支援職人　～トッププレイヤーの仕掛人～	二階堂風都
最新のゲームは凄すぎだろ	うきせくさこ
やがて最強のPKキラー（職業：商人）【旧題：やがて最強のPKK（職業：商人）】	aaa168
テイマー姉妹のもふもふ配信　～もふもふをもふもふする最愛の妹がとってもかわいいので配信で自慢してみます～	龍翠
もふもふと楽しむ無人島のんびり開拓ライフ ～VRMMOでぼっちを満喫するはずが、全プレイヤーに注目されているみたいです～（旧題：Iris Revolution Online）	紀美野ねこ
アインの伝説　～気づいた時にはもう遅い？　転生したら滅んだ村の生き残りで、勇者の幼なじみなのになかなか名前を思い出してもらえないという極めつけの脇役だったんだけどさ、どうしたらいいと思う？～	相生蒼尉
ジェノサイド・オンライン 〜極悪令嬢のプレイ日記〜	たけのこ
Mebius World Online　〜ゲーム初心者の真里姉と行くVRMMOのんびり？　体験記〜【コミカライズ３巻２０２３年１月７日発売！】【小説１〜３巻発売中】	風雲　空
Hunter and Smith Online	栗木下
ランダムでキャラを作ったんだが詰んだかもしれない	牡羊座の山羊
《Blade　Online》	夜之兎/羽咲うさぎ
掲示板の皆さま助けてください	いそがばまわる
元最強女番長が征く！VRMMO放浪記 -a Faraway Arcadia Online-	ツナ82
えむえむおー！　僕なりの楽しみ方	鴨鹿
【2023/01/10発売】『ライフで受けてライフで殴る』これぞ私の必勝法	こまるん
引っ込み思案な神鳥獣使い ―プラネット イントルーダー・オンライン―	古波萩子
《完結》『Hereafter Apollyon Online』～超高クオリティクソゲーの生産職で巨大ロボット造って遊ぼうとしてるのですが何故か勘違いされます～	西沢東＠コミカライズ企画進行中！
変態ＰＳさんのＶＲ冒険譚	猫又　寝子
ソロ神官のVRMMO冒険記　～どこから見ても狂戦士です本当にありがとうございました～	原初
Skill Build Online ～変態スナイパーによるMMORPG挑戦記～	立華凪
ギスギスオンライン	ココナッツ野山
【漫画単行本3巻発売中】神獣郷オンライン！〜『器用値極振り』で聖獣と共に『不殺』で優しい魅せプレイを『配信』します！〜	時雨オオカミ
最強の女傭兵　近未来でスポーツ美少女となる	のこのこ大王
Ｒ．Ｇ．Ｏ！	旭／星畑旭
城落としとサバイバル	Ceez
読書好きが始めるVRMMO（仮）	天　トオル
ガイド役の天使を殴り倒したら、死霊術師になりました　～皆とは別ゲーをしている気がしますが、私は元気です～	エリーゼ
アナザー・フロンティア・オンライン　～生産系スキルを極めたらチートなNPCを雇えるようになりました～	ぺんぎん
俺は星間国家の悪徳領主！	三嶋　与夢
目覚めたら最強装備と宇宙船持ちだったので、一戸建て目指して傭兵として自由に生きたい	リュート
あたしの悪徳領主様!!　～俺は星間国家の悪徳領主！　外伝～	三嶋　与夢
【４巻発売】乙女ゲームのハードモードで生きています	赤野用介
【連載版】キモオタモブ傭兵は、身の程を弁(わきま)える	土竜
私掠宇宙船から始める特務軍歴	中文字
僕と彼女と実弾兵器（アンティーク）	Gibson
完結&amp;番外編更新中　宇宙戦争掲示板ー1人なんかおかしいのがいるけどー	福郎
III count  Dead END	吹雪
死んでやる～彼女を寝取られ、死ぬに死にきれないヘタレが巻き起こす宇宙活劇～	のらしろ
宇宙船をもらった男、もらったのは星だった！？	山口遊子
カタツムリの貨客船業務日誌	土竜
若者のスペースオペラ離れを嘆く女神様に宇宙船をもらったんだが、引きこもるにはちょうどいい	小鳥遊彰吾
魔王と勇者が時代遅れになりました	結城忍
堕ちた大地で冒険者〜チート技術と超速レベルアップによる異星無双〜	謙虚なサークル
追放された伯爵公子は、超文明の宇宙要塞を手に入れました。	いつき旧太郎
アルビオン王国宙軍士官物語～クリフエッジと呼ばれた男～（クリフエッジシリーズ合本版）	愛山　雄町
ネメシス戦域の強襲巨兵【新刊7巻発売】	夜切　怜
なんかすごい性能の宇宙船を拾った	工具
エルフ・インフレーション　～際限なきレベルアップの果てに～	細川　晃
銀河ネットで仮想空間に潜ったら宇宙船の艦長に成りました。	戸川　八雲
【短編】ファンタジー用チートで万全の準備をしたのに転移したのはＳＦの世界でした。	東堂大稀（旧：To-do）
惑う星の解決法	守野伊音
【大】魔導師様、目覚める！	そういち
日雇い提督は仁愛を得て英雄へと至る	桜華　絢爛
不運なソーヤの運送屋	橋広功
クビにされた元エースパイロットが死んだ婚約者そっくりの幼女を引き取って親子になる話	梅上
ようこそ大宇宙へ！　超古代の巨大宇宙船で宇宙を征く	稲葉小僧
34歳のオッサンによるフォルトリア星系戦記	八鶴ペンギン
月にうさぎはいないけど、誰にも言えない秘密がある	優木凛々
日雇い提督・Ⅱ　神将は独立勢力を創始する～集結せよ！銀河の梁山泊へ～　　　　　　　　	桜華　絢爛
ギガファウナ　―超巨大生物の惑星―	白石健司
キモオタモブ傭兵は、身の程を弁(わきま)える	土竜
【一章完結】 AI使いの冒険者、ドローンとハッキングで無双する　～手段を選ばず金儲けしていたら宇宙一の大富豪になっていました～	田島はる
死者の船と最果ての少女	ほげ山くん
Hi-G. -ハイスピードガールズ ディスタンス-	赤川
クリフエッジシリーズ第一部：「士官候補生コリングウッド」	愛山　雄町
クリフエッジシリーズ第三部：「砲艦戦隊出撃せよ」	愛山　雄町
宇宙の片隅でスローライフ	よぎそーと／ファンティアやってる
クリフエッジシリーズ第五部：「巡航戦艦インヴィンシブル」	愛山　雄町
クリフエッジシリーズ第二部：「重巡航艦サフォーク５：孤独の戦闘指揮所（ＣＩＣ）」	愛山　雄町
うさんくさい宇宙戦艦SFモノ。	maisen
クリフエッジシリーズ第四部：「激闘！　ラスール軍港」	愛山　雄町
彗星の魔女	ヘロー天気
Planetreconstruction Company Online【VRMMO運営側＋惑星改造企業再建】	タカセ
天の川銀河の屠龍戦艦	月汰元
脱走兵は静かに暮らしたい　～最強兵器と共に異世界転移した俺、のんびり旅してたら英雄になってた～	宮葉ヒロアキ
多分……、宇宙もの……。	わだつみ
クリフエッジシリーズ外伝：「英雄の弟：ファビアン・コリングウッド」	愛山　雄町
三匹が宇宙をゆく！ーおっさんの悠々自適なセカンドライフだったと思うのだが何か違う気がする。ー	士口 十介
日本国召喚	みのろう
銀河連合日本	柗本保羽
俺のロボ	温泉卵
未来世界には古流がない！～対戦格闘型ＸＲゲームで古流剣術を使ったら掲示板がざわついた～	鼻から牛肉／樋辻臥命
Doggy House Hound	ポチ吉
「「神と呼ばれ、魔王と呼ばれても」」	しまもん（なろう版）
人類が増えすぎたので減らしてほしいと頼まれました【本編完結済】	にゃんきち
腹ペコ要塞は異世界で大戦艦が作りたい - World of Sandbox -	てんてんこ
玉葱とクラリオン	水月一人
王国騎士団を追放された俺、前世のゲーム知識で『漆黒の英雄』に成り上がる　～自国が滅んだがそんなの知らん。俺は剣と魔法とロボの世界で無双する～	馬路まんじ＠PV公開（主人公：赤羽根健治 ヒロイン：逢田梨香子）
プニキとはじめるリーグ運営　～野球ゲーム？作って運営します～	ブーブママ
「気が触れている」と王家から追い出された俺は、自説通りに超古代銀河帝国の植民船を発見し大陸最大国家を建国する。　～今さら帰って来てくれと言っても、もう遅い！　超テクノロジーを駆使した俺の建国史～	英　慈尊
ロボットアニメの艦長キャラに転生したが、このままでは謀殺されてしまいます	甘味亭太丸
砂漠と鋼とおっさんと	ゴエモン
ポンコツ宇宙船拾得顛末記（仮）	野乃たんぽぽ
実は俺、宇宙船を育てています《イイエ、育てられているのは、ア・ナ・タ》	夢見る黄龍
悠久の機甲歩兵	竹氏
貞操観念が逆転した宇宙人の軍隊でエースパイロットの俺だけが唯一男な話【書籍化決定！】	寒天ゼリヰ
Heavens Under Construction（EP5）	高山 理図 
銀河連合日本 The Next Era	柗本保羽
戦闘国家日本　(自衛隊かく戦えり)	ケイ
Doggy House Hound(s)	ポチ吉
蘇り転生の魔王、絶滅寸前の魔族を救う！	shiba
高1を12回ループしたクラスメート達が賢者モードになっている件	陽乃優一
第一次「異」世界大戦	七十八十
不死の子供たち【書籍販売中】	パウロ・ハタナカ
【デス】同じ一日を繰り返すことｎ回目、早く明日を迎えたい(´；ω；｀)【ループ】	浦田　緋色 （ウラタ　ヒイロ）
剣客ウルフ	ポチ吉
終焉機ヴィクティム	梅上
絶対ハーレム世代の男子校生	馬頭鬼
深層世界のルールブック　～現実でTRPGは無理げーでは？	のらふくろう
 “冒険者アプリ”で片田舎の高校生が現代冒険者生活を送る少し未来のお話	ダイスケ
渚さんはガベージダンプを猫と歩む。	紫炎
日本時空異聞録	笠三和大
魔法貴族の領地（料理）開発	猫の人
陸上の渚 ～異星国家日本の外交～	龍乃光輝
もしも日本が他動的な理由で有人宇宙船を打ち上げる事になってしまったなら	ほうこうおんち
【完結】夜明けに微睡むヴァンパイア～♪	shiba
██▚　現代魔術は異世界をクロールするか ： 数理科学による魔術の始め方　▚██	▚ Richard Roe ▚
『インパルス』～宝くじで900億円当たったから、理想の国を作ることにした～	時雲仁
敗北者となり追放された最弱の少女は最悪の賢者に魂を売り、最強の人形と共に復讐を果たすようです ～マリオネット・プロトコル～	kiki
超魔術転生～最強の７歳の俺に嫁と娘がいた～	暁える
【蒼星のファンファーレ】〜僕をかばって死んでしまった幼馴染の彼女を救うため、二度目の世界では知識チートを活かした最強装備の機動兵器で守り抜く〜	悠木ゆう
異星の砂漠にて、人型機械は躍動す――ＭＥＴＡＬＩＣ/ＭＡＮＥＵＶＥＲＳ	中文字
終末世界へようこそ　－目覚めたら世紀末でした－	ウムラウト
鳥取県知事ですが、著書が有害図書に指定されました	戸佐アルタ
その復讐に、太古のオーバー・テクノロジーはいかがですか？　〜解雇どころか生贄にされた戦力外兵士、戦術ＡＩ少女と新国家を立ち上げ、祖国に宣戦布告する模様〜	嵯鞠　増男
我等ヴィオラ騎士団	paiちゃん
石英ガラスの高次幻争録（メタ・ファンタジア）	小鈴危一
アメイジングノービス ～異世界でチートツールが使えたけど物理法則さんが邪魔をする～	逢須 かた丸
異世界還りのおっさんは終末世界で無双する【コミック二巻発売中！】	羽々音色
小説投稿サイトでランキング一位を取らないと出られない部屋	理不尽な孫の手
【第三部開始！！】無職マンのゾンビサバイバル生活。【第二部完結！！】	秋津モトノブ
予知と解析	こる．
ゾンビがうろつく世界になったら異世界から帰ってきた俺はどうする？　ゾンビを相手に無双するよりも生き長らえるためにどこかで拠点を作りたい	蛸山烏賊ノ介
僕以外の人類はＶＲ空間に移住した	佩ロッシュ
船が沈没して大海原に取り残されたオッサンと女子高生の漂流サバイバル＆スローライフ	かるちぇ@オッサンJK漂流記
少年Ｚ	髙田野人
アクティブ・パンデミック	コロンビア
不死の配送人	ヘロー天気
メリーさん・イン・ゾンビアポカリプス～瓦礫に埋まって数十年。やっと地上に出れたと思ったら人類が滅亡寸前なんですが？～	瘴気領域
JK無双　終わる世界の救い方 	蒼蟲夕也
ゾンビになったと追放された俺は人類を救えるかもしれないけど人類は救いようがない	しゃぼてん
終焉のコドク	百舌巌
キャンプで出会った連中がたどった顛末	よぎそーと／ファンティアやってる
核シェルター付きマンションを相続した男が快適に引き籠る物語	グレゴリー
異世界帰り・オブ・ザ・デッド	時をかけたい少女
2126年　状態：生存	паранойя
スローライフ・オブ・ザ・デッド	ぺんぎん
滅亡世界と安価スレ	西沢東＠コミカライズ企画進行中！
Crawler's	水川湖海
その国の終焉	高月水都
崩壊世界で目覚めたら馴染みのあるロボを見つけたので、強気に生き抜こうと思います	ユーリアル
レッドサンブラックムーン -機密解除された第二次大戦における＜異世界からの干渉＞および＜魔獣との戦闘＞に関する記録と証言について-	弐進座
日韓戦争・日本海炎上――日本国自衛隊vs大韓民国国軍――	河畑濤士
終焉の世界でゾンビを見ないままハーレムを作らされることになったわけで…	緑豆空
無人島パラドックス――我、無人島にてイケメンに勝利せり――	大舞 神
聖女の半分は優しさで出来ています～キル・オール・エネミー～	銀星石
謎の密室で目を覚ましたら、知らない男の声が「さあゲームの始まりだ」とか何とか言っているが、そんなことよりも今すぐトイレに行かないとヤバい。	やまだのぼる
エンディング後の世界を生き残る僕ら	ゆうき
[連載版] トロル	舛本つたな
ベジタリアンテレパシスト	キムラ
プレッパー・サバイバー〜ゾンビ？地震？終わった世界で必要なのはチートでなく知識です。俺を追い出したクラスメイト、今更戻ってきてと言ってももう遅い！〜	山田 時裕
アンデッド・アポカリプス　～ゾンビに嫌われた俺が行く終末世界～　	鬼管いすき
交錯世界の日章旗	名も無き突撃兵
俺を召喚したせいで異世界が魔力を使い切ったようです	昼熊
ムゲンループのカシコイ生き方	koutori
戦場のフロンティア 　～気がついたら銃と兵器のゲーム世界に生産職で転生してた～	邑上主水
2 : 8	松浦アエト
無人島サバイバル　How to survive on a desert island.	綿貫瑞人
星姫計画	クンスト
ゆき　～東京を、史上最大の降雪が襲うとき～	兎津母
ガルディシア帝国の興亡	酒精四十度
世界にゾンビが溢れても、うちだけは安全だ	くまのき
梅花、百鬼を魁る	色付きカルテ
もしも悪役令嬢が世紀末覇者だったら	ユート
【緊急】村で人喰いモンスターが暴れてるらしい【事態】	カズキ@積みディスク消化中
その人の名は狂気――influence panic――	無道
「ローソン、サハラ砂漠中央店？」	ＭＵＭＵ
終焉の世界でゾンビを見ないままハーレムを作らされることになったわけで… サイドストーリー	緑豆空
元勇者のおじいさんと元聖女のおばあさんが秒で全てを解決する昔話	たなか
泉の女神に恋をした俺は金の斧も銀の斧もいらない。	しいたけ
もう遅いと言われた男の話	曲尾　仁庵
世界で一番醜い娘と世界で一番美しい若者	楠瑞稀
各方面に配慮した桃次郎と桃子[かくほうめんにはいりょしたももじろうとももこ]（順不同）≪ふりがなつき≫【There’s English】	たなか
どうぞ。おなかをなでてください。	りすこ
星が泣いたあの日に起きたこと	海野宵人
魔王に拐われた姫が勇者に嫁ぐ話	冬里 尊
詐欺師がついた最後の嘘	はなまる
星降る夜に落ちた子	千東風子
一人だけ難易度が明らかにおかしいかぐや姫	しいたけ
世界で一番口の悪い教師	みなもとさとり
果たされる約束	朝野りょう
薬草転生物語	鬼影スパナ
お掃除をしていたら幸せになった、片付け下手なOLさんのおはなし	石河 翠
金の斧と銀の斧と普通の斧を纏めて泉へ投げ込んでみた	しいたけ
流れ星と皇子	小田 ヒロ
物語のつぼと魔女	風羽洸海
メスガキの恩返し	やまおか
魔法の鏡が王妃を好きすぎる	たらこくちびる毛
それから後のシンデレラ	瀬嵐しるん
人魚姫はビッチな姉たちのあれやこれやでバッドエンドを回避する	くろつ
仕切り屋 シンデレラ	瀬嵐しるん
わたしにしか見えない王子さま　	小択出新都
消えた王国	千東風子
【完結】桃太郎の養子は鬼が倒せず追放される。前世知識ときびだんご作って、かわいい妹ともふもふ達に囲まれ、のんびり暮らします。	東夷
冬の王と春の妃	ピヨ/七海ちよ
魔王は玉座で「もう遅いのだ」とつぶやいた	曲尾　仁庵
世界を救った聖女のおはなし	辺野 夏子
腐界の王	曲尾　仁庵
もしも浦島太郎が助けた亀に連れられて行ったのが竜宮城ではなく深淵に眠る名状しがたき旧き神を祀る海底神殿だったら	チンチラすずめ
名もなき女神はサービス過剰	瀬嵐しるん
世間に虐げられしおっさんは実は聖女でしたが、今日も楽しく過ごします	ベキオ
野原の小さな魔女	高菜あやめ
捨て子のエイプリルと、忘れられたぬいぐるみの王子さま	石河 翠
剣振りかぶり姫	夕景あき
ローズお姉さまのドレス	有沢真尋
森の中の不思議なお店	どんC
お父さまが『けいやくけっこん』したおあいては、イケメンマッチョなお兄さまでした。	砂礫零
白雪姫とちびふわ	桜瀬彩香
少女は雲を洗う	瀬嵐しるん
スライムのよろず屋さん　～すごいけどすごくないお店に今日も遊びに行きます～	森野
